{
  "fixed_test_run_id": "fullchain_challenger_momentum_only_20260418_1140",
  "run_id": "fullchain_challenger_momentum_only_20260418_1140",
  "attempt_id": "attempt_challenger_momentum_only_20260418_1145",
  "generated_at": "2026-04-18T11:42:21.558957+08:00",
  "candidate_scheme_id": "baseline_momentum_v4",
  "research_round_id": "rr_baseline_challenger_drop_reversal_20260418",
  "holdings_count": 60673,
  "unique_instruments": 3355,
  "signal_dates_with_positions": 6300,
  "avg_exit_delay_days": 0.7593353403968663,
  "delayed_exit_positions": 2582,
  "terminal_event_positions": 290,
  "total_entry_fill_weight": 195.7193548386655,
  "avg_turnover_daily": 0.061830431421535534,
  "median_turnover_daily": 0.06451612903225806,
  "max_turnover_daily": 0.12580645161290321,
  "rebalance_days": 6299,
  "run_state_summary_counts": {
    "project_label_panel_rows": 15818326,
    "project_sample_panel_rows": 15818326,
    "project_execution_panel_rows": 15818326,
    "labels_masked_rows": 224131,
    "tradability_degraded_rows": 0,
    "terminal_event_rows": 314,
    "terminal_event_degraded_rows": 314,
    "terminal_event_flagged_rows_in_execution": 2121,
    "execution_unresolved_rows": 20443,
    "sample_masked_rows": 325924,
    "ranking_state_rows": 15818326,
    "execution_state_rows": 15818326,
    "ranking_anomaly_rows": 135887,
    "rankable_rows": 15097814,
    "null_model_score_rows": 720512,
    "nonfinite_model_score_rows": 0,
    "topk_frozen_rows": 63020,
    "execution_attempt_rows": 63020,
    "entry_filled_rows": 60673,
    "backtest_executable_rows": 60673,
    "unfilled_topk_count": 2347,
    "unfilled_topk_weight": 234.70000000000002,
    "topk_per_signal_breach_count": 0,
    "topk_default_used": 10
  },
  "warnings": [
    "execution_path_daily contains unresolved or unpriced rows.",
    "ranking_eligible_D0 rows with missing or nonfinite model_score_D0 were excluded from TopK.",
    "terminal_event_daily is present but partially degraded in the shared source."
  ],
  "fatal_blockers": []
}
