{
  "fixed_test_run_id": "confirmatory_fixed_test_imax20_trainval_20260430_round4",
  "run_id": "confirmatory_imax20_trainval_20260430_round4",
  "attempt_id": "attempt_20260430_153332",
  "generated_at": "2026-04-30T15:36:55.752327+08:00",
  "candidate_scheme_id": "price_volume_single_signal_alpha158_imax20_v1",
  "research_round_id": "rr_confirmatory_alpha158_high_invested_weight_head_extraction_shortlist_round4_20260430",
  "holdings_count": 52315,
  "unique_instruments": 2307,
  "signal_dates_with_positions": 5327,
  "avg_exit_delay_days": 0.23042954636692092,
  "delayed_exit_positions": 1388,
  "terminal_event_positions": 4,
  "total_entry_fill_weight": 373.6785714284956,
  "avg_turnover_daily": 0.14018543827209606,
  "median_turnover_daily": 0.14285714285714285,
  "max_turnover_daily": 0.2,
  "rebalance_days": 5331,
  "run_state_summary_counts": {
    "project_label_panel_rows": 11198074,
    "project_sample_panel_rows": 11198074,
    "project_execution_panel_rows": 11198074,
    "labels_masked_rows": 185647,
    "tradability_degraded_rows": 0,
    "terminal_event_rows": 144,
    "terminal_event_degraded_rows": 144,
    "terminal_event_flagged_rows_in_execution": 622,
    "execution_unresolved_rows": 610,
    "sample_masked_rows": 273653,
    "ranking_state_rows": 11198074,
    "execution_state_rows": 11198074,
    "ranking_anomaly_rows": 0,
    "rankable_rows": 10780956,
    "null_model_score_rows": 417118,
    "nonfinite_model_score_rows": 0,
    "topk_frozen_rows": 53270,
    "execution_attempt_rows": 53270,
    "entry_filled_rows": 52315,
    "backtest_executable_rows": 52315,
    "unfilled_topk_count": 955,
    "unfilled_topk_weight": 95.5,
    "topk_per_signal_breach_count": 0,
    "topk_default_used": 10
  },
  "warnings": [
    "execution_path_daily contains unresolved or unpriced rows.",
    "terminal_event_daily is present but partially degraded in the shared source."
  ],
  "fatal_blockers": []
}
