{
  "fixed_test_run_id": "fullchain_price_volume_refresh_hysteresis_20260422_143317",
  "run_id": "fullchain_price_volume_refresh_hysteresis_20260422_143317",
  "attempt_id": "attempt_20260422_143548",
  "generated_at": "2026-04-22T14:41:28.712472+08:00",
  "candidate_scheme_id": "price_volume_v18_refresh_hysteresis",
  "research_round_id": "rr_price_volume_refresh_hysteresis_family_20260422",
  "holdings_count": 62974,
  "unique_instruments": 2564,
  "signal_dates_with_positions": 6300,
  "avg_exit_delay_days": 0.27251926590927145,
  "delayed_exit_positions": 1584,
  "terminal_event_positions": 9,
  "total_entry_fill_weight": 350.00000000002785,
  "avg_turnover_daily": 0.11104145726426673,
  "median_turnover_daily": 0.11111111111111112,
  "max_turnover_daily": 0.16666666666666666,
  "rebalance_days": 6299,
  "run_state_summary_counts": {
    "project_label_panel_rows": 15818326,
    "project_sample_panel_rows": 15818326,
    "project_execution_panel_rows": 15818326,
    "labels_masked_rows": 224131,
    "tradability_degraded_rows": 0,
    "terminal_event_rows": 314,
    "terminal_event_degraded_rows": 314,
    "terminal_event_flagged_rows_in_execution": 2121,
    "execution_unresolved_rows": 20443,
    "sample_masked_rows": 325924,
    "ranking_state_rows": 15818326,
    "execution_state_rows": 15818326,
    "ranking_anomaly_rows": 135887,
    "rankable_rows": 4519330,
    "null_model_score_rows": 720512,
    "nonfinite_model_score_rows": 0,
    "topk_frozen_rows": 63020,
    "execution_attempt_rows": 63020,
    "entry_filled_rows": 62070,
    "backtest_executable_rows": 62070,
    "unfilled_topk_count": 950,
    "unfilled_topk_weight": 95.0,
    "topk_per_signal_breach_count": 0,
    "topk_default_used": 10,
    "liquidity_guard_excluded_rows": 10661994
  },
  "warnings": [
    "execution_path_daily contains unresolved or unpriced rows.",
    "ranking_eligibility_guard excluded rows from the ranking universe before TopK freeze.",
    "ranking_eligible_D0 rows with missing or nonfinite model_score_D0 were excluded from TopK.",
    "terminal_event_daily is present but partially degraded in the shared source."
  ],
  "fatal_blockers": []
}
